{
  "case_id": "ATR_72-212_A_G-IACZ_11-25",
  "evidence_freeze_time_utc": "2026-01-08",
  "items": [
    {
      "id": "H1",
      "source": "history",
      "text": "The plan was to fly two sectors as a return service between Newquay and London Gatwick."
    },
    {
      "id": "S1",
      "source": "synopsis",
      "text": "The flaps could not be deployed to full extension for landing and the commander decided to perform a go-around. Weather conditions were unfavourable so after initially declaring a MAYDAY, the aircraft diverted to Exeter Airport where landing flap was achieved. The landing was uneventful, but several unrelated anomalies were reported to have occurred during the subsequent ground taxi."
    }
  ],
  "pdf_sha256": "168f4b9338294b5bde977f95d947b6f1b442bb5e9c9dc7fa4768da27ed6444cc"
}
